,Job Title,Company Name,Salary From,Salary To,Region,Full Address,Apply URL,Vacancy URL,Publication Time,Archived,Requirements,Responsibilities
675,Требуется учитель по рисованию и живопись,Центр образовательных услуг Білім,180000.0,200000.0,Астана,"Астана, проспект Женис, 29/1",https://hh.ru/applicant/vacancy_response?vacancyId=108631749,https://hh.ru/vacancy/108631749,2024-10-14T16:34:21+0300,False,Высшее образование. Умение работать с детьми и в коллективе.,Работа с детьми. Обучение по программе дамубала.
676,"Учитель математики (для классов с английским языком обучения в Международную школу ""Мирас"")",Общественный фонд «NNEF»,500000.0,,Алматы,"Алматы, проспект Аль-Фараби, 190",https://hh.ru/applicant/vacancy_response?vacancyId=109469039,https://hh.ru/vacancy/109469039,2024-10-28T14:35:03+0300,False,Высшее педагогическое образование. Свободное владение английским языком. Опыт работы в школе. Приветствуется знания в SAT.,Преподавание предмета математики на английском языке для учащихся основной и старшей школы. Эффективно использовать различные методики и материалы для удовлетворения...
677,English Teacher,Лингвоэксперт,,,Астана,,https://hh.ru/applicant/vacancy_response?vacancyId=108430465,https://hh.ru/vacancy/108430465,2024-10-09T17:42:55+0300,False,"Plan and deliver engaging lessons to adult learners, with a focus on fostering effective communication skills. Hold a Bachelor's...",Conduct up to 30 teaching hours per week (full-time position involves 5 consecutive work days with guaranteed 2 consecutive...
678,English teacher - Part time/Full time,Ayala (StudyON),150000.0,450000.0,Алматы,"Алматы, проспект Сакена Сейфуллина, 498",https://hh.ru/applicant/vacancy_response?vacancyId=108202071,https://hh.ru/vacancy/108202071,2024-10-28T17:54:43+0300,False,Bachelor’s degree in English and education. Minimum of 1 years experience in a teaching role. The ability to compile...,Supportive team culture that fosters collaboration and creativity.
679,Педагог хореограф современного танца,Sana Центр творчества(ИП Айару),,100000.0,Астана,"Астана, улица Евгения Брусиловского, 5",https://hh.ru/applicant/vacancy_response?vacancyId=108220347,https://hh.ru/vacancy/108220347,2024-10-06T22:50:02+0300,False,Современный подход к обучению.,Проводить занятия согласно расписанию. Выбор репертуара. Участие в конкурсах. Нужные принадлежности для проведения занятий.
680,Менеджер по продажам,ИВАНОВ И.А. «Школа робототехники Byte»,200000.0,350000.0,Усть-Каменогорск,,https://hh.ru/applicant/vacancy_response?vacancyId=108953807,https://hh.ru/vacancy/108953807,2024-10-21T11:23:48+0300,False,"Желателен опыт работы в продажах или в сфере B2B-партнерств, предпочтительно с образовательными учреждениями. Отличные навыки переговоров и...",Поддержка существующих партнерств. Проведение презентаций: Организовывать и проводить презентации для детей и родителей. Контроль и планирование деятельности <highlighttext>преподавателей</highlighttext>. 
681,Учитель,Азия транс авто,150000.0,250000.0,Алматы,"Алматы, микрорайон Мамыр-4, 301",https://hh.ru/applicant/vacancy_response?vacancyId=107891300,https://hh.ru/vacancy/107891300,2024-09-29T15:30:21+0300,False,Опыт работы <highlighttext>учителем</highlighttext>. - Понимание принципов финансовой грамотности и предпринимательства или открыт для изучения. - Умение работать с детьми школьного возраста. - ,Планирование и проведение уроков: - Разработка учебных планов и программ в соответствии с учебными стандартами. - Подготовка и проведение интерактивных и увлекательных...
682,Учитель китайского языка,Smart Imperium,,,Алматы,"Алматы, 6-й переулок, 24",https://hh.ru/applicant/vacancy_response?vacancyId=107918530,https://hh.ru/vacancy/107918530,2024-09-30T10:31:54+0300,False,"Образование в сфере лингвистики, филологии или педагогики. Опыт преподавания китайского языка. Владение китайским языком, подтвержденное сертификатами. Коммуникабельность, энергичность, стремление к...",Подготовка учебного плана. Проведения уроков. Проверка домашнего задания. Находить подход к каждому ученику.
683,Преподаватель технических дисциплин,Школьные уроки,150000.0,250000.0,Актау,,https://hh.ru/applicant/vacancy_response?vacancyId=108913173,https://hh.ru/vacancy/108913173,2024-10-20T21:41:47+0300,False,"Математическое, физико-техническое или IT-образование. Хорошее знание школьной программы по математике и физике. Знание основ программирования, школьной программы по...","Объяснение новых тем по алгебре, геометрии и физике. Обучение информатике и основам программирования. Контроль и проверка решений. Выявление и устранение..."
684,Администратор,East-expert,85000.0,200000.0,Усть-Каменогорск,"Усть-Каменогорск, улица Серикбаева, 1К1",https://hh.ru/applicant/vacancy_response?vacancyId=108101380,https://hh.ru/vacancy/108101380,2024-10-03T08:31:55+0300,False,"Навык работы с людьми, умение заинтересовать и расположить человека, по-настоящему понять, что ему важно. Умение уверенно коммуницировать с клиентами...",Помогать и консультировать клиентов в выборе курсов. Вести коммуникации с клиентами и <highlighttext>преподавателями</highlighttext>. Следить за чистотой и порядком в центре...
685,Хореограф,Мергенова,80000.0,400000.0,Астана,"Астана, улица Шаймердена Косшыгулулы, 8/2",https://hh.ru/applicant/vacancy_response?vacancyId=108256691,https://hh.ru/vacancy/108256691,2024-10-07T12:41:57+0300,False,"Опыт работы 5 лет и выше. Хореографическое образование. Ответственность. Любовь к детям и танцевальному искусству. Владение 2 языками (казахский,русский). ","Проведение отрытых уроков с присутствием родителей. Присутствие на собрании,два раза в неделю с руководителем ансамбля. Постановка интересных и синхронных..."
686,Координатор по академической поддержке студентов,KIMEP,,,Алматы,"Алматы, проспект Абая, 2",https://hh.ru/applicant/vacancy_response?vacancyId=108805107,https://hh.ru/vacancy/108805107,2024-10-26T15:11:24+0300,False,"...для работы с различными группами, включая сотрудников, студентов, родителей и <highlighttext>преподавателей</highlighttext>; исключительные организационные способности, а также письменные и устные навыки...","...выявления студентов группы риска; функционирование системы ""раннего оповещения"", которая позволяет <highlighttext>преподавателям</highlighttext> идентифицировать и оказывать поддержку студентам, которых они считают находящимися..."
687,Учитель английского языка,Качан Дарья,100000.0,,Алматы,"Алматы, Наурызбайский район",https://hh.ru/applicant/vacancy_response?vacancyId=108898060,https://hh.ru/vacancy/108898060,2024-10-19T20:25:34+0300,False,Знание английского языка не ниже уровня Intermediate. Владение казахским языком. Пунктуальность и ответственность. Желание постоянного обучения и внедрения новой информации.,Проведение уроков английского языка в соответствии с учебным планом. Поддержание интерактивной и эффективной образовательной атмосферы. Оценка и анализ успеваемости студентов.
688,Логопед-дефектолог\ Нейропсихолог\ABA терапист,Детский коррекционный центр Первые шаги,150000.0,300000.0,Алматы,"Алматы, улица Егизбаева, 7/7",https://hh.ru/applicant/vacancy_response?vacancyId=109124650,https://hh.ru/vacancy/109124650,2024-10-23T10:16:07+0300,False,Высшее педагогическое образование. Знание русского и казахского языка. Умение работать с детьми с задержками развития. Опыт работы с детьми с...,Проведение индивидуальных и групповых занятий по развитию речи и коррекции речевых нарушений. Работа с детьми‚ имеющими неврологическую патологию (задержки речевого...
689,Преподаватель продленного дня (начальная школа),Step to Success,,,Алматы,"Алматы, улица Жарокова, 290",https://hh.ru/applicant/vacancy_response?vacancyId=108152985,https://hh.ru/vacancy/108152985,2024-10-03T21:47:58+0300,False,Сильные академические знания начальной школы. Высшее образование (желательно образование <highlighttext>педагога</highlighttext> начальной школы). Ответственность. Пунктуальность. Стрессоустойчивость и умение держать дисциплину в...,Выполнять домашние задания с учениками (1-4 классы) согласно школьной программе - не более 12 человек в группе. Повышение успеваемости отстающих...
690,Учитель английского языка,Acasc study in china,250000.0,500000.0,Алматы,,https://hh.ru/applicant/vacancy_response?vacancyId=107972044,https://hh.ru/vacancy/107972044,2024-10-01T09:08:33+0300,False,В офис нужна сотрудница со знанием английского языка в совершенстве(так как клиенты в основном из англоговорящих стран). Пунктуальность. ,Консультирование наших партнеров и новых абитуриентов по поводу наших стипендиальных программ в университетах Китая.
691,Учитель математики Quantum Tech School,BI Education,,,Астана,,https://hh.ru/applicant/vacancy_response?vacancyId=107278982,https://hh.ru/vacancy/107278982,2024-10-23T10:13:00+0300,False,"Высшее образование. - Опыт успешной работы в преподавании математики, используя инновационные методы и подходы. - Наличие сертификата IELTS.",Преимуществом будет преподавание по программе AP calculus и Cambridge AS/A level.
692,Учитель русского языка в центр подготовки MetaStudy,MetaStudy,200000.0,,Алматы,,https://hh.ru/applicant/vacancy_response?vacancyId=108623583,https://hh.ru/vacancy/108623583,2024-10-26T15:01:34+0300,False,Наличие диплома бакалавра. Уметь грамотно и доступно объяснять материал простым языком. Наличие сертификатов приветствуется.,"Преподавать русский язык школьникам 3-8 классов. Готовить учеников к различным олимпиадам, в НИШ, РФМШ и другие специализированные школы города. "
693,Учитель начальных классов с русским языком обучения,ТУСУПБЕКОВА СР,200000.0,,Караганда,Караганда,https://hh.ru/applicant/vacancy_response?vacancyId=108780903,https://hh.ru/vacancy/108780903,2024-10-17T10:21:59+0300,False,Стрессоустойчивость. Любовь к детям.,Помощь в выполнении домашнего задания. Подготовка к сор и соч.
694,Педагог-психолог,Almaty ABA Services ( Алматы АБА Сервисес),,,Алматы,"Алматы, улица Асанбая Аскарова, 10",https://hh.ru/applicant/vacancy_response?vacancyId=107926854,https://hh.ru/vacancy/107926854,2024-09-30T12:04:23+0300,False,"Степень бакалавра (или близость к завершению степени бакалавра). - Сильная устная и письменная коммуникация, тайм-менеджмент, организационные навыки и ориентированность на...",Обязанности: Каждый клиент ABC имеет индивидуальный план развития; ABA терапист несет ответственность за качественное проведения работы с ребенком и его...
695,Заместитель директора по воспитательной работе(завуч),PRIZMA SCHOOL,450000.0,600000.0,Алматы,"Алматы, Алатауский район, микрорайон Акбулак, улица Сарайшык, 26",https://hh.ru/applicant/vacancy_response?vacancyId=108737479,https://hh.ru/vacancy/108737479,2024-10-28T14:01:07+0300,False,"...или ""заместитель руководителя первой квалификационной категории"" организации образования, либо наличие квалификации ""<highlighttext>педагог</highlighttext> – эксперт"" или наличие ""<highlighttext>педагог</highlighttext> – исследователь"" или ""<highlighttext>педагог</highlighttext> – мастер"".",Осуществляет организацию воспитательного процесса школы. Обеспечивает разработку планов и мероприятий по организации воспитательной работы.Руководствуется учебно-воспитательной и организационной работой школы. 
696,Педагог-психолог,ОФ ФОНД ГРАЖДАНСКИХ ИНИЦИАТИВ Q-ADAM,180000.0,350000.0,Астана,"Астана, улица Караоткель, 31",https://hh.ru/applicant/vacancy_response?vacancyId=108744187,https://hh.ru/vacancy/108744187,2024-10-16T15:17:38+0300,False,"Обучение основам (внимание, усидчивость, командная работа). Занятия на мелкую моторику. Любовь к детям. Пунктуальность. Грамотность. Ответственность. Стрессоустойчивость.",Развитие творческой деятельности.
697,"Foreign teacher with a native English speaking level, to a medical university",КАЗАХСТАНСКО-РОССИЙСКИЙ МЕДИЦИНСКИЙ УНИВЕРСИТЕТ,,500000.0,Алматы,"Алматы, проспект Абылай хана, 51",https://hh.ru/applicant/vacancy_response?vacancyId=109485603,https://hh.ru/vacancy/109485603,2024-10-28T20:17:21+0300,False,"A foreign <highlighttext>teacher</highlighttext> with a native English speaking level, to a medical university. * At least 5 years of experience in...","conducting educational work (lectures, practical, laboratory and seminar classes). * organization of the educational process (drawing up methodological instructions, preparing visual..."
698,Офис-менеджер,CHINGIZTRADE,200000.0,,Караганда,"Караганда, проспект Строителей, 22",https://hh.ru/applicant/vacancy_response?vacancyId=108656902,https://hh.ru/vacancy/108656902,2024-10-15T10:19:52+0300,False,"Законченное среднее или высшее образование. Ответственность. Если вы НЕ пунктуальны, то вам эта работа НЕ подходит. Аккуратность, приветливость, умение находить...","Ведение документации и прием платежей. Работа с родителями, детьми и <highlighttext>преподавателями</highlighttext>. Обеспечение безопасности в образовательном центре. Обеспечение своевременных проведении занятии. "
699,Учитель программирования (разработчик),Частная Школа Пифагор,,,Алматы,Алматы,https://hh.ru/applicant/vacancy_response?vacancyId=108843496,https://hh.ru/vacancy/108843496,2024-10-18T12:34:50+0300,False,"Умение держать аудиторию, пробуждать интерес к изучению предмета. Умение грамотно и простым языком объяснить материал. Энергичность (проактивность). Педагогический диплом. ","Преподавать ученикам по программам подготовки к вступительным экзаменам НИШ, РФМШ, БИЛ и другие специализированные школы, лицеи. Преподавать ученикам по школьным..."
700,Учитель по рисованию,Шнарова А,50000.0,100000.0,Уральск,"Уральск, улица Гумара Караша",https://hh.ru/applicant/vacancy_response?vacancyId=108211230,https://hh.ru/vacancy/108211230,2024-10-05T18:20:35+0300,False,,"Сурет салу, қолөнер үйірмесіне мұғалім іздейміз. Қойылатын талаптар: жауапкершілігі мол, баламен жақсы қарым қатынас орната алу."
701,Учитель русского языка и литературы,Школа-лицей Квант,450000.0,,Алматы,село Байсерке,https://hh.ru/applicant/vacancy_response?vacancyId=108771334,https://hh.ru/vacancy/108771334,2024-10-26T08:18:39+0300,False,Квалификационные требования к <highlighttext>учителю</highlighttext> русского языка и литературы: Высшее образование по специальности. Знание Государственных общеобязательных стандартов образования и других нормативных...,"Отличное владение содержанием учебного предмета, учебно-воспитательным процессом, методикой преподавания и оценивания; педагогикой и психологией."
702,Видеограф/Монтажер,OQUWAY,250000.0,300000.0,Алматы,,https://hh.ru/applicant/vacancy_response?vacancyId=108363039,https://hh.ru/vacancy/108363039,2024-10-08T17:08:19+0300,False,"Опыт работы в качестве видеографа и монтажера не менее 2 лет, желательно в сфере образования. — Уверенное владение программами для видеомонтажа...","Разработка сценариев и концепций видеоматериалов в сотрудничестве с методистами и <highlighttext>преподавателями</highlighttext>. — Обработка и редактирование видео, включая работу со звуковыми эффектами..."
703,Учитель истории,BI Education,,,Астана,,https://hh.ru/applicant/vacancy_response?vacancyId=108712214,https://hh.ru/vacancy/108712214,2024-10-16T09:12:16+0300,False,Высшее и (или) послевузовское педагогическое образование. Опыт работы с программой IB Международный бакалавриат.,Осуществляет обучение и воспитание обучающихся с учетом специфики преподаваемого предмета. Способствует формированию общей культуры личности обучающегося и его социализации. 
704,Менеджер по работе с клиентами,American School Kazakhstan (Американ Скул Казахстан),150000.0,260000.0,Астана,"Нур-Султан (Астана), жилой комплекс Эдем Палас-2",https://hh.ru/applicant/vacancy_response?vacancyId=108542877,https://hh.ru/vacancy/108542877,2024-10-12T08:18:18+0300,False,Коммуникабельность. Ответственность. Умение работать в команде. Активная позиция в жизни. Стандартный график работы.,...языке тоже приветствуется). Составление расписания <highlighttext>преподавателям</highlighttext>. Звонки и консультации. Работа с кассовым аппаратом. Помощь <highlighttext>преподавателям</highlighttext>. Административная работа. Знание иностранных языков...
705,Учитель истории,Частная Школа Пифагор,,,Алматы,Алматы,https://hh.ru/applicant/vacancy_response?vacancyId=108646992,https://hh.ru/vacancy/108646992,2024-10-15T07:59:37+0300,False,"Умение держать аудиторию, пробуждать интерес к изучению предмета. Умение грамотно и простым языком объяснить материал. Энергичность (проактивность). Педагогический диплом. ","Преподавать ученикам по программам подготовки к вступительным экзаменам НИШ, РФМШ, БИЛ и другие специализированные школы, лицеи. Преподавать ученикам по школьным..."
706,Преподаватель IELTS и английского языка,Айешев,500000.0,600000.0,Уральск,,https://hh.ru/applicant/vacancy_response?vacancyId=109334865,https://hh.ru/vacancy/109334865,2024-10-26T11:58:17+0300,False,"Свой балл IELTS 7.0 или выше (просьба, если у вас нет сертификата IELTS, не писать).",Готовить к экзамену IELTS.
