,Job Title,Company Name,Salary From,Salary To,Region,Full Address,Apply URL,Vacancy URL,Publication Time,Archived,Requirements,Responsibilities
0,Преподаватель,TUMAR,200000.0,400000.0,Шымкент,,https://hh.ru/applicant/vacancy_response?vacancyId=109449983,https://hh.ru/vacancy/109449983,2024-10-28T11:40:06+0300,False,Обязателен опыт работы <highlighttext>учителем</highlighttext> в школе. - Высшее педагогическое образование по соответствующей специальности. - Отличное знание своего предмета и навыки его преподавания. - ,
1,Администратор,Muse School,200000.0,500000.0,Астана,"Астана, улица Митченко, 46",https://hh.ru/applicant/vacancy_response?vacancyId=109482963,https://hh.ru/vacancy/109482963,2024-10-28T18:03:45+0300,False,Мы всему научим - от вас нужно только желание развиваться!,"...тренинги по продажам. Консультировать по видам абонементов. Поддерживать позитивную, веселую атмосферу в школе. Составлять расписание уроков для учеников и <highlighttext>преподавателей</highlighttext>."
2,Учитель английского языка,CAREER AND EDUCATION CENTER,190000.0,250000.0,Астана,"Нур-Султан (Астана), улица Кордай, 81",https://hh.ru/applicant/vacancy_response?vacancyId=109452299,https://hh.ru/vacancy/109452299,2024-10-28T11:55:32+0300,False,диплом по профилю с 21-го года. - уровень английского от Intermediate. - знание ПК. - ответственное отношение к работе. - ведение курсов английского...,контроль усвоения материала программы каждого ребенка. - проведение занятий в игровой форме. - интересная подача учебного материала.
3,Куратор в образовательный центр,Hard skills foundation,150000.0,,Алматы,"Алматы, улица Маркова, 61/1",https://hh.ru/applicant/vacancy_response?vacancyId=109429858,https://hh.ru/vacancy/109429858,2024-10-28T09:17:39+0300,False,Знание и свободное владение русским и казахским языками (ОБЯЗАТЕЛЬНО!).,Общение и поддержание дружеских отношений со студентами. Введение отчетов в Google таблицы. Налаживание связи между студентами и <highlighttext>преподавателями</highlighttext>.
4,Няня в семью,Корпорация управления бизнесом (КУБ),250000.0,,Алматы,,https://hh.ru/applicant/vacancy_response?vacancyId=108779806,https://hh.ru/vacancy/108779806,2024-10-17T10:09:14+0300,False,"Опыт работы воспитателем в детских садах, няней в семьях, <highlighttext>учителем</highlighttext> начальных классов, аниматором. - Можно рассмотреть в т.ч. ","Осуществление полного ухода за ребенком. - Совместное времяпровождение – игры, развивашки, прогулки. - Сопровождение ребенка (ТРЦ, занятия и т.д.). - Поручения по хозяйству."
5,Учитель английского языка,Подготовительные курсы,300000.0,500000.0,Шымкент,"Шымкент, улица Байтурсынова, 88",https://hh.ru/applicant/vacancy_response?vacancyId=109152009,https://hh.ru/vacancy/109152009,2024-10-23T15:58:35+0300,False,Обучение английского языка разным возрастным группам от уровня Elementary до Upper Intermediate/Advanced. -уровень владения английским языком не ниже С...,"Презентация занятий, проведение презентационных уроков."
6,Администратор учебного центра,Perfect Study (Сандыбаева К. Ж.),100000.0,170000.0,Караганда,,https://hh.ru/applicant/vacancy_response?vacancyId=108817439,https://hh.ru/vacancy/108817439,2024-10-17T20:44:17+0300,False,"Высокие коммуникативные навыки, грамотная письменная и устная речь. Организованность, пунктуальность, ответственность, умение работать с людьми, вежливость. Владение MS Office, Excel...","Консультация клиентов и запись на пробные уроки. Выполнять административные поручения руководства. Ведение расписания <highlighttext>учителей</highlighttext>. Быть лицом школы, активно участвовать в..."
7,Психолог,Лабеан компани,400000.0,600000.0,Алматы,село Каргалы,https://hh.ru/applicant/vacancy_response?vacancyId=108834749,https://hh.ru/vacancy/108834749,2024-10-18T10:48:10+0300,False,"Диплом о высшем образовании по специальности: "" <highlighttext>Педагог</highlighttext>- психолог"", "" Практический психолог"". Наличие опыта работы по специальности. Знание психологических методов (тестов) диагностики. ","Психологическая диагностика, проведение развивающих мероприятий, тренингов, лекционных занятий, социологических опросов."
8,Педагог по подготовке к школе (казахская группа),SANA,230000.0,250000.0,Астана,"Нур-Султан (Астана), улица Алихана Бокейханова, 29Б",https://hh.ru/applicant/vacancy_response?vacancyId=109420509,https://hh.ru/vacancy/109420509,2024-10-28T06:55:40+0300,False,Пунктуальность и ответственность. Грамотность и знание языка в совершенстве. Знание английского ( 1-2 уровень ).,Подготовить детей к школе. Составить месячный план. Найти контакт с детьми и родителями. Полное инфо на собеседовании.
9,Преподаватель английского языка,Есеркенова А.С,240000.0,480000.0,Астана,,https://hh.ru/applicant/vacancy_response?vacancyId=109062509,https://hh.ru/vacancy/109062509,2024-10-22T13:52:44+0300,False,Опыт работы <highlighttext>преподавателем</highlighttext> английского языка не менее года. Наличие сертификата IELTS/TOEFL/Duolingo. Стабильное подключение к высокоскростному интернету.,"Составлять аутентичные онлайн занятия по заданным направлениям (General English, Business English, IELTS preparation). Вести интерактивные занятия с упором на разговорную..."
10,Куратор/учитель в школу,QSCHOOL,200000.0,200000.0,Алматы,,https://hh.ru/applicant/vacancy_response?vacancyId=108418919,https://hh.ru/vacancy/108418919,2024-10-27T15:09:45+0300,False,Высшее педагогическое образование по соответствующему предмету. Отличное знание своего предмета и умение доходчиво объяснять материал. Владение современными технологиями и опыт...,Проведение онлайн уроков через Zoom. Проверка домашних заданий и предоставление обратной связи ученикам. Отвечать на вопросы учеников. Составление презентации на...
11,Менеджер по продажам минеральных удобрений,BayDala,310000.0,1169500.0,Кокшетау,,https://hh.ru/applicant/vacancy_response?vacancyId=109432262,https://hh.ru/vacancy/109432262,2024-10-28T09:42:05+0300,False,Имеете опыт: не менее 1 года в сфере продаж в области сельского хозяйства. Знаете языки: свободно говорите на казахском и...,Развитие клиентской базы: активный поиск и привлечение новых клиентов. Работа в СРМ системе - Битрикс. Выезд к клиенту или работа с...
12,Администратор офиса,IELTS CLUB,140000.0,,Алматы,"Алматы, Минусинская улица, 13Б",https://hh.ru/applicant/vacancy_response?vacancyId=108239286,https://hh.ru/vacancy/108239286,2024-10-07T10:02:30+0300,False,Опыт работы в административной сфере или в сфере обслуживания клиентов приветствуется. - Отличные коммуникативные навыки и способность эффективно взаимодействовать с клиентами. - ,"Консультации и регистрации студентов на экзамен IELTS. - Учет посещаемости <highlighttext>преподавателей</highlighttext> и учеников. - Ведение телефонных переговоров, обработка электронной почты и консультирование..."
13,Педагог-воспитатель на ПОЛДНЯ в группу Мини-Сад,A.K.N.Power,150000.0,200000.0,Астана,"Астана, проспект Тауелсиздик, 6/3",https://hh.ru/applicant/vacancy_response?vacancyId=108201462,https://hh.ru/vacancy/108201462,2024-10-04T17:43:45+0300,False,"Увлеченность и ответственность. Педагогическое образование (наличие дополнительного образования приветствуется). Желателен опыт работы в частной сфере: детский клуб, частная школа, частный...","Работа по готовым разработанным конспектам, Подготовка к занятию, наведение порядка после занятия, Общение с родителями, Участие в жизни клуба. "
14,Менеджер по продажам минеральных удобрений,BayDala,310000.0,1169500.0,Костанай,,https://hh.ru/applicant/vacancy_response?vacancyId=109432320,https://hh.ru/vacancy/109432320,2024-10-28T09:42:45+0300,False,Имеете опыт: не менее 1 года в сфере продаж в области сельского хозяйства. Знаете языки: свободно говорите на казахском и...,Развитие клиентской базы: активный поиск и привлечение новых клиентов. Работа в СРМ системе - Битрикс. Выезд к клиенту или работа с...
15,Администратор,DANCING QUEEN,150000.0,,Астана,"Астана, проспект Мангилик Ел, 41/5",https://hh.ru/applicant/vacancy_response?vacancyId=108217926,https://hh.ru/vacancy/108217926,2024-10-06T14:28:53+0300,False,"С высокой энергией, скоростью и позитивом. Легко общается с людьми и умеет подружиться. Быстро учится и быстро думает. ","Встреча клиентов. Продажи абонементов. Следить за порядком в студии. Контроль за работой команды: <highlighttext>педагогов</highlighttext>, тех персонала."
16,Учитель английского языка,Шагирова Е.С,180000.0,220000.0,Астана,,https://hh.ru/applicant/vacancy_response?vacancyId=109049226,https://hh.ru/vacancy/109049226,2024-10-22T11:32:22+0300,False,Диплом с 2020 по 2024 (не иметь пенсионки по специальности ). Не иметь ип. Требования: Знание английского и казахского языка.,
17,Студенческий координатор,InterPress - International House,200000.0,500000.0,Алматы,,https://hh.ru/applicant/vacancy_response?vacancyId=108587606,https://hh.ru/vacancy/108587606,2024-10-14T09:11:42+0300,False,Английский язык не ниже Pre-Intermediate. Отличное знание казахского языка. Наличие опыта работы в сфере продаж. Уверенное знание компьютера (Internet...,"Помощь клиенту в выборе программы обучения. Формирование групп. Оформление клиента на обучение, текущая работа с клиентами. Взаимодействие с <highlighttext>преподавателями</highlighttext>."
18,Ассистент в начальную школу со знанием английского языка,Smart Imperium,200000.0,,Алматы,"Алматы, 6-й переулок, 24",https://hh.ru/applicant/vacancy_response?vacancyId=109463923,https://hh.ru/vacancy/109463923,2024-10-28T13:35:22+0300,False,Уровень английского Upper-Intermediate и выше. Педагогическое образование. Любовь к детям. Порядочность. Доброжелательность.,
19,Преподаватель английского языка,ELC Astana,100000.0,,Астана,"Астана, переулок Иманова, 19",https://hh.ru/applicant/vacancy_response?vacancyId=109377735,https://hh.ru/vacancy/109377735,2024-10-27T09:32:29+0300,False,"Английский язык от B2 и выше, не беспокоить у кого ниже или не твердый Upper-intermediate. Коммуникабельность. ",Обучать Английскому языку по методике центра. Работать со школьниками так и со взрослыми.
20,Администратор школы танцев/Менеджер по работе с клиентами,Ибраева Г.А.,100000.0,150000.0,Астана,"Нур-Султан (Астана), улица Кенесары, 52",https://hh.ru/applicant/vacancy_response?vacancyId=109160118,https://hh.ru/vacancy/109160118,2024-10-23T17:57:42+0300,False,Высшее образование. -Грамотная речь. -Умение работать в режиме многозадачности и четко расставлять приоритеты. -Способность находить общий язык и с взрослыми...,контроль оплат за абонементы. -составление штатного расписания и осуществление замен <highlighttext>преподавателей</highlighttext>. -помощь в организации внутришкольных мероприятий. -выполнение административных поручений. -
21,Педагог ассистент русскоговорящий,ГКП на ПХВ Школа-лицей №79 акимата города Астаны,115000.0,125000.0,Астана,"Астана, улица Максута Нарикбаева, 3",https://hh.ru/applicant/vacancy_response?vacancyId=109325588,https://hh.ru/vacancy/109325588,2024-10-26T09:17:54+0300,False,Требования: Высшее педагогическое образование. Наличие НКТ. Грамотная речь и письмо на русском языке. Умение работать с детьми.,"Работа под кураторством по готовой программе (ABA терапия, школьники с РАС, Аутизмом). Ведение документации по ученикам. Сопровождение на уроки. "
22,Администратор,Dirxen,250000.0,500000.0,Астана,"Астана, улица Динмухамеда Кунаева, 14/1",https://hh.ru/applicant/vacancy_response?vacancyId=108793108,https://hh.ru/vacancy/108793108,2024-10-17T12:23:06+0300,False,Мы всему научим - от вас нужно только желание развиваться! Экологичный продукт - качественное и эффективное обучение для взрослых и подростков от...,"...со стороны руководства. Консультировать по видам абонементов. Поддерживать позитивную, веселую атмосферу в школе. Составлять расписание уроков для учеников и <highlighttext>преподавателей</highlighttext>."
23,Администратор (Менеджер по работе с клиентами),Damira Bal Project,60000.0,150000.0,Астана,,https://hh.ru/applicant/vacancy_response?vacancyId=107891028,https://hh.ru/vacancy/107891028,2024-09-29T14:39:30+0300,False,"С высокой энергией, скоростью и позитивом. Легко общается с людьми и умеет подружиться. Быстро учится и быстро думает. ","Встреча клиентов. Продажи абонементов. Следить за порядком в студии. Контроль за работой команды: <highlighttext>педагогов</highlighttext>, тех персонала."
24,Педагог английского языка,TOP KIDS ASTANA,100000.0,150000.0,Астана,"Астана, улица Абубакира Тыныбаева, 7",https://hh.ru/applicant/vacancy_response?vacancyId=109167001,https://hh.ru/vacancy/109167001,2024-10-23T19:23:39+0300,False,"Образование: педагогическое образование, желательно профильное (английский язык, филология, лингвистика). Опыт работы: опыт преподавания английского языка детям в аналогичных образовательных учреждениях. ","Проведение занятий: подготовка и проведение уроков английского языка для детей разных возрастных групп, включая разработку программ обучения и использование интерактивных..."
25,Менеджер,Dirxen,200000.0,500000.0,Астана,"Астана, микрорайон Шубар, улица Митченко, 46",https://hh.ru/applicant/vacancy_response?vacancyId=108912511,https://hh.ru/vacancy/108912511,2024-10-26T19:46:15+0300,False,Мы всему научим - от вас нужно только желание развиваться!,"...тренинги по продажам. Консультировать по видам абонементов. Поддерживать позитивную, веселую атмосферу в школе. Составлять расписание уроков для учеников и <highlighttext>преподавателей</highlighttext>."
26,"Продавец-кассир (ТЦ ""Форум"")",Глория Джинс Каспиан,,,Алматы,"Алматы, проспект Сакена Сейфуллина, 617",https://hh.ru/applicant/vacancy_response?vacancyId=109427667,https://hh.ru/vacancy/109427667,2024-10-28T08:57:27+0300,False,"Не имеешь опыта работы, но готов обучаться. Готов работать в интенсивном режиме. Дружелюбный, общительный.",Консультируют покупателей. Пополняют товар и поддерживает порядок в торговом зале. Ведут полный цикл работ с кассовым аппаратом.
27,Педагог дополнительного образования,Нургалиева Б.Р.,200000.0,,Астана,"Нур-Султан (Астана), улица Шокана Валиханова, 5",https://hh.ru/applicant/vacancy_response?vacancyId=108941422,https://hh.ru/vacancy/108941422,2024-10-21T10:09:47+0300,False,"Если Вы: общительный, креативный человек. Находите точку соприкосновения и с ребенком, и взрослым. Открыты к новым знаниям. Сфера вашей ответственности:",Подача информации согласно методике. Контроль динамики и результатов по итогу занятий. Работа с документацией.
28,Администратор в студию танцев,Ru.Inc,150000.0,,Астана,"Астана, улица Динмухамеда Кунаева, 25",https://hh.ru/applicant/vacancy_response?vacancyId=108661001,https://hh.ru/vacancy/108661001,2024-10-15T11:00:15+0300,False,,Встречать и консультировать клиентов. Делать звонки. Обязательно продавать. Заполнять таблицы и отчёты. Работа в системе CRM. Вести учет занятий и...
29,Администратор в образовательном центре,Fibonacci,300000.0,500000.0,Алматы,"Алматы, проспект Абая, 143",https://hh.ru/applicant/vacancy_response?vacancyId=107033907,https://hh.ru/vacancy/107033907,2024-10-28T09:59:23+0300,False,Возможность работать полный день. Высшее образование приветствуется. Знание русского языка в совершенстве. Отличное владение MS Office (в особенности MS Excel). ,"Снабжение офиса: заказ воды, покупка/заказ канцелярских товаров и прочее. Поддержка обратной связи с клиентами Заказчика. Контроль <highlighttext>преподавателей</highlighttext> и работников..."
30,Куратор учебного центра,ERA KZ,150000.0,300000.0,Алматы,"Алматы, проспект Достык, 97Б",https://hh.ru/applicant/vacancy_response?vacancyId=107903350,https://hh.ru/vacancy/107903350,2024-09-30T08:20:42+0300,False,Отличные организационные и коммуникативные навыки. Умение работать в режиме многозадачности и быстро принимать решения. Знание основ документооборота и работы с...,"Координирует учебный процесс, организует занятие и следит за соблюдением расписания. Взаимодействует с <highlighttext>преподавателями</highlighttext> и студентами, решая административные вопросы и обеспечивая..."
31,Преподаватель Английского языка в KILC,КАЗАХСТАНСКИЙ МЕЖДУНАРОДНЫЙ КОЛЛЕДЖ,200000.0,300000.0,Астана,,https://hh.ru/applicant/vacancy_response?vacancyId=109422130,https://hh.ru/vacancy/109422130,2024-10-28T07:37:48+0300,False,"Образование ""Переводческое дело""(обязательно). Наличие сертификатов CELTA / TESOL / IELTS / TOEFL / FCE приветствуется. Опыт работы преподавания. Коммуникабельность, Отзывчивость, Любовь к своему...",Проведение занятий. Подготовка. Планирование. Контроль процесса обучения.
32,Преподаватель в школу английского языка «English Classes»,English classes,150000.0,300000.0,Алматы,,https://hh.ru/applicant/vacancy_response?vacancyId=109145261,https://hh.ru/vacancy/109145261,2024-10-23T14:25:08+0300,False,Владение английским – не ниже уровня Upper Intermediate. Опыт преподавания детям в возрасте 6 - 12 лет. Профильное и/или лингвистическое образование.,"Проведение групповых и индивидуальных занятий детям, взрослым и корпоративным клиентам разных уровней. Преподавание в формате офлайн и онлайн. "
