,Job Title,Company Name,Salary From,Salary To,Region,Full Address,Apply URL,Vacancy URL,Publication Time,Archived,Requirements,Responsibilities
333,Администратор в образовательный центр,Общественный фонд ARSHALA,220000.0,250000.0,Алматы,,https://hh.ru/applicant/vacancy_response?vacancyId=107969843,https://hh.ru/vacancy/107969843,2024-10-27T09:32:39+0300,False,Опыт работы в административной сфере — приветствуется. Прекрасные коммуникативные навыки. Умение работать с Microsoft Office и базовыми офисными программами. ,"Общение с клиентами: ответы на вопросы, консультации, работа с отзывами. Ведение документации и отчетности. Поддержка и помощь <highlighttext>преподавателям</highlighttext> и ученикам. "
334,Преподаватель физической культуры,ALT Университет имени Мухамеджана Тынышпаева,,,Алматы,,https://hh.ru/applicant/vacancy_response?vacancyId=108187208,https://hh.ru/vacancy/108187208,2024-10-04T14:34:45+0300,False,"Высшее, физическая культура и спорт. Опыт работы в сфере спорта, кандидат спорта. Знание своего предмета. Ответственность, пунктуальность. Организовывать спортивные мероприятия. ","Организация учебного процесса в соответствии с установленными планами и стандартами. Использование в своей работе самых разнообразных, эффективных и современных методов..."
335,Семейная помощница/семейный помощник,Частное образовательное Учреждение SOS Детская деревня Темиртау,188500.0,188500.0,Темиртау,,https://hh.ru/applicant/vacancy_response?vacancyId=108188454,https://hh.ru/vacancy/108188454,2024-10-04T14:49:21+0300,False,"Ваше образование - не ниже средне-специального, желательно в области педагогики, социальной педагогики, психологии, медицины. Ваше желание работать с детьми и...","Помогать маме-воспитателю в бытовых вопросах. Замещать маму-воспитателя во время выходных, отпуска, больничных. Поддержка <highlighttext>педагогов</highlighttext> и психологов по вопросам..."
336,Преподаватель английского языка,Абдельдина,160000.0,260000.0,Караганда,"Караганда, район имени Казыбек би, жилой район Юго-Восток",https://hh.ru/applicant/vacancy_response?vacancyId=108898226,https://hh.ru/vacancy/108898226,2024-10-19T21:18:43+0300,False,"Высшее образование в области иностранных языков, педагогики. Уровень английского не ниже Upper-Intermediate. Коммуникабельность - умение находить общий язык как со...","Проведение уроков General English для взрослых от 16 лет по собственной программе студии, согласно готовому плану курса. Возможно, работа с..."
337,Учитель английского языка,ДЖАМБУРБАЕВА МЕРУЕРТ УРАЛОВНА,100000.0,,Астана,"Астана, улица Петрова, 16/2",https://hh.ru/applicant/vacancy_response?vacancyId=108231875,https://hh.ru/vacancy/108231875,2024-10-07T08:50:22+0300,False,"Всегда быть активным в рабочем пространстве. - Активный, инициативный и оригинальный. - Ответственный и с пониманием тайм менеджмента. - Быстро-обучаемый, стрессоустойчивый и...",Обучение <highlighttext>преподавателей</highlighttext> КОУЧИНГОВОМУ подходу. Выполнять поставленные задачи от руководства. - Have a great eager to work!
338,Преподаватель Английского языка в онлайн языковой центр,Дюсембинова,200000.0,300000.0,Алматы,,https://hh.ru/applicant/vacancy_response?vacancyId=108963370,https://hh.ru/vacancy/108963370,2024-10-21T13:05:37+0300,False,"Высокая квалификация, коммуникабельность, пунктуальность. Занятие нужно проводить на Английском языке. Минимум 4 года опыта работы.","Преподавание Английского языка в мини-группах, в парах и индивидуально. Используемый учебник New English File, Solutions, Prepere, Family and friends. "
339,Учитель английского языка,Daily English,100000.0,200000.0,Астана,,https://hh.ru/applicant/vacancy_response?vacancyId=108470941,https://hh.ru/vacancy/108470941,2024-10-10T14:57:08+0300,False,"Высшее образование по специальности ""Английский язык"" или смежной области. Опыт преподавания английского языка (желательно от 1 года). Отличное знание английского...",Проведение групповых занятий 5-6 дней в неделю. Подготовка и адаптация учебного материала различных уровней. Поддержание дисциплины и создание позитивной...
340,Менеджер по разработке образовательных программ,Qazaq Education Group,200000.0,350000.0,Алматы,,https://hh.ru/applicant/vacancy_response?vacancyId=108507444,https://hh.ru/vacancy/108507444,2024-10-11T11:06:07+0300,False,"Опыт работы на аналогичной должности не менее 2 лет. Опыт проектирования образовательных программ, создания учебных курсов. Опыт участия в аккредитациях...",Анализ образовательных тенденций и внедрение лучших практи. Взаимодействие с <highlighttext>преподавателями</highlighttext> и экспертами для разработки контента. Контроль качества учебных материалов и...
341,Менеджер по продажам,ИВАНОВ И.А. «Школа робототехники Byte»,200000.0,350000.0,Уральск,,https://hh.ru/applicant/vacancy_response?vacancyId=108954124,https://hh.ru/vacancy/108954124,2024-10-21T11:27:23+0300,False,"Желателен опыт работы в продажах или в сфере B2B-партнерств, предпочтительно с образовательными учреждениями. Отличные навыки переговоров и...",Поддержка существующих партнерств. Проведение презентаций: Организовывать и проводить презентации для детей и родителей. Контроль и планирование деятельности <highlighttext>преподавателей</highlighttext>. 
342,Учитель начальных классов в продленку,Данилова О.М (Детский центр Ай да Я!),130000.0,150000.0,Алматы,"Алматы, улица Кассина, 56",https://hh.ru/applicant/vacancy_response?vacancyId=109484970,https://hh.ru/vacancy/109484970,2024-10-28T19:17:49+0300,False,Опыт работы с детьми. Высшее/средне-специальное педагогическое образование. Знание обновленной программы. Умение находить подход к детям и родителям.,Проведение занятий для детей начальных классов. Помощь в освоении школьной программы. Контроль выполнения домашних заданий.
343,Преподаватель английского языка,Языковой центр English Up&Up,200000.0,450000.0,Усть-Каменогорск,,https://hh.ru/applicant/vacancy_response?vacancyId=108619825,https://hh.ru/vacancy/108619825,2024-10-14T14:25:45+0300,False,"Гибкость, умение находить общий язык с учениками. Требования: Наличие высшего профессионального образования.","Проведение занятий по английскому языку для подростков, детей и взрослых в группах, мини группах и индивидуально. Составление плана занятий. "
344,Учитель английского языка,Филиал ТОО SMG Education - Центр образовательных проектов SMG Education Atyrau,250000.0,280000.0,Атырау,"Атырау, улица Махамбета Утемисова, 101А",https://hh.ru/applicant/vacancy_response?vacancyId=108896593,https://hh.ru/vacancy/108896593,2024-10-19T15:14:38+0300,False,Контроль приобретённых знаний. Аналитическое мышление и умение работать с текстом. Требования: Желательно опыт работы по подготовке детей к поступлению в...,Проведение групповых занятий. Предоставление материала (авторская книга).
345,Педагог по направлению IT,ГККП Дворец школьников,,200000.0,Алматы,"Алматы, проспект Достык, 124",https://hh.ru/applicant/vacancy_response?vacancyId=109421699,https://hh.ru/vacancy/109421699,2024-10-28T07:25:54+0300,False,"Требования: (наличие НКТ обязательно). - Знание методологии работы с детьми школьного возраста. - доброжелательность, терпимость уважение. - знание технологии своего направления. - саморазвитие. - ",составление образовательной программы. - стратегическое планирование и ведение документации. - набор и работа с детьми (школьный возраст). - участие в мероприятиях объединения. - 
346,Педагог раннего развития и подготовки к школе,Бегимов Н.А,150000.0,150000.0,Алматы,"Алматы, 3-й микрорайон, 65",https://hh.ru/applicant/vacancy_response?vacancyId=108919378,https://hh.ru/vacancy/108919378,2024-10-21T07:27:37+0300,False,Высшее педагогическое образование. Опыт работы с детьми от 1 года. Умение в игровой форме заинтересовать ребенка. Занятия проводить на русском...,Проведение занятий для группы раннего развития от 3-5лет. Проведение занятий для группы подготовка к школе 5-7.
347,Учитель математики,АБДУРАЗАКОВА,150000.0,250000.0,Шымкент,"Шымкент, улица Алпысбаева, 102",https://hh.ru/applicant/vacancy_response?vacancyId=109165278,https://hh.ru/vacancy/109165278,2024-10-23T19:00:07+0300,False,Высшее или неоконченное высшее образование по направлению “Математика” или смежным дисциплинам. Опыт работы с учениками разных возрастных категорий (желательно). ,"Проведение занятий по математике (возможны уровни от школьной программы до подготовки к экзаменам). Подготовка учащихся к экзаменам, в том числе..."
348,Ассистент учителя начальных классов,Школа Мозаика-Казахстан,150000.0,180000.0,Караганда,,https://hh.ru/applicant/vacancy_response?vacancyId=108130751,https://hh.ru/vacancy/108130751,2024-10-03T14:32:03+0300,False,"Педагогическое образование (можно студенты , в том числе). Навыки работы с детьми.","Помогать <highlighttext>учителю</highlighttext> на классе, во время обучения по программе, рекомендованной Министерством образования. Помощь в ведение школьной документации."
349,Преподаватель английского языка,Онлайн-школа English House (ИП Жаманкулов Ж.М.),,,Алматы,,https://hh.ru/applicant/vacancy_response?vacancyId=108292430,https://hh.ru/vacancy/108292430,2024-10-07T17:09:01+0300,False,Мотивация работать. Уровень английского - выше Upper-Intermediate. Умение пользоваться офисными программами. Стабильное интернет соединение. Наличие ПК/ноутбука/планшета.,Обучать студентов английскому языку. Делать отчет по проведенному уроку. Улучшать уровень английского языка. Находить индивидуальный подход каждому студенту.
350,Преподаватель дошкольного образования,Зерделі,200000.0,450000.0,Павлодар,,https://hh.ru/applicant/vacancy_response?vacancyId=108524169,https://hh.ru/vacancy/108524169,2024-10-11T15:11:59+0300,False,Требования к структуре образовательной программы дошкольного образования.,Организация различных видов деятельности и общения воспитанников. Организация образовательной деятельности по реализации основной общеобразовательной программы дошкольного образования. Требования: Наблюдение за...
351,Преподаватель английского языка,Education for you,150000.0,400000.0,Астана,,https://hh.ru/applicant/vacancy_response?vacancyId=108158281,https://hh.ru/vacancy/108158281,2024-10-04T07:58:31+0300,False,"Ответственное отношение к работе, детям и результатам. - Средне-специальное или высшее образование. - Свободное владение английским языком. - Знание и применение различных...",Проведение групповых и индивидуальных занятий для подростков и детей. - Работа по программам и методикам нашей школы. - Ведение отчетности.
352,Администратор,БАИМБЕТОВА А. М,175000.0,230000.0,Астана,Астана,https://hh.ru/applicant/vacancy_response?vacancyId=108890484,https://hh.ru/vacancy/108890484,2024-10-19T09:39:57+0300,False,"ориентирована на результат. -с высокой энергией, скоростью и позитивом. -легко общается с людьми и умеешь подружиться. -быстро учишься и быстро...","Организация мероприятий - от мастер классов до концертов и вечеринок! -Контроль за работой команды: <highlighttext>педагогов</highlighttext>, тех персонала. -Составление расписания."
353,Учитель начальных классов,LIMAN KIDS ИП ЛИМАН В.М.,100000.0,250000.0,Алматы,"Алматы, улица Торайгырова, 19А",https://hh.ru/applicant/vacancy_response?vacancyId=108522004,https://hh.ru/vacancy/108522004,2024-10-11T14:36:41+0300,False,Пунктуальность. Ответственность. Умение работать с детьми.,Контроль за исполнением дом.заднаия. Доп.занятия. Закрепление. Повторение проиденного материала.
354,Учитель английского языка,AG Education Center,200000.0,300000.0,Алматы,,https://hh.ru/applicant/vacancy_response?vacancyId=107889334,https://hh.ru/vacancy/107889334,2024-09-29T10:40:13+0300,False,"Высшее / среднее специальное педагогическое/лингвистическое образование (английский язык). Любовь к своему делу, ответственность, пунктуальность, активность, стремление к результату, коммуникабельность, дисциплина.","Проведение групповых и индивидуальных занятий для детей, школьников, студентов и взрослых."
355,Мектеп алды даярлык тобының мұғалімі,ОЦ NICE,200000.0,200000.0,Алматы,"Алматы, улица Навои, 208/1",https://hh.ru/applicant/vacancy_response?vacancyId=107674749,https://hh.ru/vacancy/107674749,2024-10-16T12:22:17+0300,False,Здравствуйте! Образовательный центр NICE ищет <highlighttext>преподавателей</highlighttext> по подготовке детей к школе. Только с опытом работы в группах в аналогичной сфере! ,<highlighttext>Педагог</highlighttext> по подготовке детей к школе. В казахскую группу.
356,Преподаватель английского языка для детей онлайн,ИНТЕР-А 2020,150000.0,400000.0,Астана,Казахстан,https://hh.ru/applicant/vacancy_response?vacancyId=107968981,https://hh.ru/vacancy/107968981,2024-10-01T08:33:27+0300,False,Английский на уровне Upper-Intermediate - Advanced. Пунктуальность (опоздания исключены). Стремление к развитию (чтение профессиональной литературы и прохождение курсов внутри компании...,"<highlighttext>Преподаватель</highlighttext> английского языка для детей и взрослых онлайн формата! 3. Всеми материалами (игры, канцелярские товары, печатные материалы и тд.)."
357,Учитель русского языка и литературы,BI Education,,,Астана,,https://hh.ru/applicant/vacancy_response?vacancyId=109031074,https://hh.ru/vacancy/109031074,2024-10-22T09:13:06+0300,False,Мы ищем опытного и преданного <highlighttext>учителя</highlighttext> русского языка и литературы . Идеальный кандидат должен обладать обширным опытом в области преподавания русского...,
358,Педагог раннего развития,Интернет магазин Кит,,,Караганда,,https://hh.ru/applicant/vacancy_response?vacancyId=107916617,https://hh.ru/vacancy/107916617,2024-09-30T10:09:52+0300,False,Умения общаться с родителями своих малышей. Желательно педагогическое образование. Знание основ детской психологии. Грамотная речь. Навыки обучения детей дошкольного возраста.,Участие в праздничных с участием детей и их родителей.
359,Педагог-воспитатель,КУРМАНБАЕВА А. К.,200000.0,300000.0,Актобе,,https://hh.ru/applicant/vacancy_response?vacancyId=108729698,https://hh.ru/vacancy/108729698,2024-10-16T12:22:43+0300,False,Опыт работы не меньше года. Знание методик раннего развития. Знание казахского и русского языков. Грамотная и поставленная речь. Актерские способности. ,Проводить занятия согласно структуре и расписанию. Развивающая деятельность с воспитанниками. Организация досугов и праздничных часов.
360,Учитель русского языка и литературы,Зерделі,200000.0,450000.0,Астана,,https://hh.ru/applicant/vacancy_response?vacancyId=109327382,https://hh.ru/vacancy/109327382,2024-10-26T10:12:38+0300,False,"Умение обучать с 2-6 классов. Пунктуальность. Ответственность. Не опаздывать, быть во время на работе.","Преподавание для подготовки НИШ, БИЛ, РФМШ. Всегда быть на готове к урокам."
361,Монтессори педагог (3-6) (Педагог в Монтессори сад),Жердев Р.Н.,300000.0,450000.0,Алматы,"Алматы, Звёздная улица, 79",https://hh.ru/applicant/vacancy_response?vacancyId=108910701,https://hh.ru/vacancy/108910701,2024-10-20T14:53:51+0300,False,Владение Монтессори методом (AMI стандарт). Уважение к детям. Педагогическое или психологическое образование. Грамотная речь. Владение педагогическим мастерством (песенно-моторные игры...,"Работа с разновозрастной группой детей по методу Марии Монтессори. Сопровождение режимных мероприятий (прогулка, сон, прием пищи). Обеспечивать досуговую деятельность и..."
362,Педагог-психолог,Частная Школа Пифагор,300000.0,300000.0,Алматы,Алматы,https://hh.ru/applicant/vacancy_response?vacancyId=109475301,https://hh.ru/vacancy/109475301,2024-10-28T15:57:11+0300,False,Высшее образование в области психологии (детская психология предпочтительна). Опыт работы с детьми в образовательной или медицинской сфере. Отличные коммуникативные и...,Взаимодействие с <highlighttext>учителями</highlighttext> и родителями для создания оптимальных условий обучения и воспитания детей. Участие в разработке и проведении профилактических программ...
363,Преподаватель английского языка,ANGELSTREAM,250000.0,300000.0,Алматы,"Алматы, пр. Абая, 52 В, Офис 321",https://hh.ru/applicant/vacancy_response?vacancyId=107918312,https://hh.ru/vacancy/107918312,2024-09-30T10:29:24+0300,False,"Желательно наличие дополнительных сертификатов (IELTS, TOEFL). Опыт работы по специальности 1-3 лет. Владение Английским языком на уровне Upper Intermediate. ","Преподавание групповых, индивидуальных, корпоративных занятий, также детским группам. Проведение занятий студентам всех уровней английского: от beginner до advanced. "
