,Job Title,Company Name,Salary From,Salary To,Region,Full Address,Apply URL,Vacancy URL,Publication Time,Archived,Requirements,Responsibilities
1013,Педагог - психолог,Акопова Е.Р.,,,Актау,,https://hh.ru/applicant/vacancy_response?vacancyId=109185915,https://hh.ru/vacancy/109185915,2024-10-24T07:30:21+0300,False,Образование по специальности. Опыт работы. Грамотная поставленная устная и письменная речь. Стрессоустойчивость. Готовность обучаться на регулярной основе.,Обучение и воспитание детей дошкольного возраста. Инклюзия. Ведение занятий для детей в возрасте от 2 до 7 лет. 
1014,Педагог-логопед,ЦИР АйДаУм,120000.0,500000.0,Усть-Каменогорск,"Усть-Каменогорск, улица Кабанбай Батыра, 158А",https://hh.ru/applicant/vacancy_response?vacancyId=108661193,https://hh.ru/vacancy/108661193,2024-10-15T11:02:13+0300,False,Логопедическое образование. Дефектология. Знание программы начальной школы. Желательное умение : владение двумя языками.,Ведение группы продленного дня. Работа с детьми с проблемами речи. Организовывать детей в игры и мероприятия.
1015,Учитель по физике с казахским языком обучения,Абжанов Ж. А.,300000.0,484000.0,Шымкент,"Шымкент, Каратауский район",https://hh.ru/applicant/vacancy_response?vacancyId=109054461,https://hh.ru/vacancy/109054461,2024-10-22T12:20:53+0300,False,Высшее педогогическое образование.,Организация педагогического процесса. Ведение уроков. Объяснение учебных материалов. Проведение контрольных работ и экзаменов. Проверка домашних заданий. Выставление оценок. 
1016,"Преподаватель для детей по курсу ""Unity""",ITSTEP Academy Almaty,,,Караганда,"Караганда, проспект Бухар Жырау, 75/3",https://hh.ru/applicant/vacancy_response?vacancyId=109134646,https://hh.ru/vacancy/109134646,2024-10-23T12:00:52+0300,False,Опыт работы на Unity не менее 1года. Опыт в преподавании будет преимуществом. Наличие готового портфолио/практических работ. ,Проведение лекционных и практических занятий по курсу Unity. Обучить слушателей основам Unity. Познакомить студентов со средой. Научить студентов создавать меню...
1017,Клинический педагог (дефектолог - логопед - спецпедагог),Частный фонд Фонд Булата Утемуратова,350000.0,350000.0,Астана,"Астана, улица Достык, 13",https://hh.ru/applicant/vacancy_response?vacancyId=108272093,https://hh.ru/vacancy/108272093,2024-10-07T14:04:38+0300,False,"Высшее педагогическое образование по специальностям: Дефектология. логопедия, специальная педагогика, психолог, олигофренопедагог. Готовность обучаться, изучать новые инструменты, методики, практики работы с...",Проведение оценки навыков ребенка с РАС. Разработка индивидуальной программы развития ребенка на основе оценки навыков. Реализация программы интервенции. 
1018,Педагог по рисованию,OXFORD CREATIVE SCHOOL,100000.0,350000.0,Актобе,,https://hh.ru/applicant/vacancy_response?vacancyId=108854298,https://hh.ru/vacancy/108854298,2024-10-18T14:47:40+0300,False,"Энергичны, уверенны в себе. * Ориентированы на достижение результата.",Умеете устанавливать и поддерживать долгосрочные отношения с детьми и их родителями. * Проводить уроки согласно расписанию. * Проводить открытые уроки для родителей. * 
1019,Преподаватель английского языка,Тутушина В.Е,150000.0,300000.0,Павлодар,"Павлодар, проспект Нурсултана Назарбаева, 18",https://hh.ru/applicant/vacancy_response?vacancyId=108277835,https://hh.ru/vacancy/108277835,2024-10-07T14:53:30+0300,False,,
1020,Преподаватель начальных классов,ОРДА Султан,100000.0,180000.0,Атырау,"Атырау, микрорайон Жилгородок, улица Маншук Маметовой, 26",https://hh.ru/applicant/vacancy_response?vacancyId=108654819,https://hh.ru/vacancy/108654819,2024-10-15T09:56:57+0300,False,Педагогическое образование по специальности «<highlighttext>Учитель</highlighttext> начальных классов». Знание и понимание процесса подготовки и проведения СОР и СОЧ. Опыт работы с...,Возможности для участия в семинарах и тренингах по улучшению процесса подготовки к СОР и СОЧ.
1021,Учитель информатики,Центр подготовки (AIPLUS),,,Шымкент,,https://hh.ru/applicant/vacancy_response?vacancyId=108962994,https://hh.ru/vacancy/108962994,2024-10-27T13:01:46+0300,False,Имели огромное желание обучать детей и обучаться самим. Грамотно владеете устной и письменной речью. Нацелены на результат.,"Обучение детей в оффлайн формате, занятия проходят в филиалах AIPLUS. Развитие учеников по нашей собственной программе обучения. Работа с Айплюсовцами..."
1022,Педагог-психолог/психолог /дефектолог,Детский центр развития особенных детей Rainbow,200000.0,300000.0,Астана,Астана,https://hh.ru/applicant/vacancy_response?vacancyId=107900665,https://hh.ru/vacancy/107900665,2024-09-30T07:29:43+0300,False,Ответственность. Любовь к детям. Аккуратность. Желание развиваться и расти.,"Проведение занятий с детьми у кого трудности в развитии. ЗРР, ЗПРР, СДВГ, РАС."
1023,Учитель химии в русскоязычную школу,НУО Лидер,,,Алматы,"Алматы, микрорайон Орбита-4, 25Б",https://hh.ru/applicant/vacancy_response?vacancyId=108314602,https://hh.ru/vacancy/108314602,2024-10-08T08:36:56+0300,False,,Осуществляет обучение и воспитание обучающихся с учетом специфики преподаваемого предмета. Обязан иметь тематический план работы по предмету на учебную четверть...
1024,Учитель начальных классов,Школа Мозаика-Казахстан,200000.0,240000.0,Актобе,,https://hh.ru/applicant/vacancy_response?vacancyId=108360393,https://hh.ru/vacancy/108360393,2024-10-08T16:46:51+0300,False,Педагогическое образование. Навыки работы с детьми.,"Обучение класса детей совместно с ассистентом по программе, рекомендованной Министерством образования. Ведение школьной документации."
1025,Преподаватель IT специальности,Учреждение Международный колледж бизнеса и коммуникаций,,,Алматы,"Алматы, микрорайон Жетысу-2, 16А",https://hh.ru/applicant/vacancy_response?vacancyId=108047177,https://hh.ru/vacancy/108047177,2024-10-02T12:05:15+0300,False,"Нужны <highlighttext>преподаватели</highlighttext> по специальностям IT знание языков программирования (С++, С#). Графические прjграммы (3DS Max, Maya). Объектно ориентированное программирование.","Базы данных (My SQL). Разработка МБ (Android Studio, Flutter и т.д.). Web программирование."
1026,Преподаватель естествознания,Образовательный центр TODAY,300000.0,,Астана,,https://hh.ru/applicant/vacancy_response?vacancyId=108779704,https://hh.ru/vacancy/108779704,2024-10-17T10:07:55+0300,False,Имеете высшее образование и опыт работы в аналогичной сфере. Владеете современными методиками обучения. Жаждете постоянно учиться и развиваться. ,Подготовка учеников 6-х классов к тесту в НИШ по программе 5-6 классов по предмету естествознание.
1027,Учитель математики на казахском/русском языке,Зерделі,200000.0,500000.0,Уральск,,https://hh.ru/applicant/vacancy_response?vacancyId=107913873,https://hh.ru/vacancy/107913873,2024-09-30T09:41:55+0300,False,Высшее образование. Разносторонность. Знание предмета. Ответственность.,"Знание русского и казахского языка, для преподавание занятии на двух языках. Откликаться с резюме, где указаны достяжения по предмету. "
1028,Преподаватель технических дисциплин,Школьные уроки,150000.0,250000.0,Кызылорда,,https://hh.ru/applicant/vacancy_response?vacancyId=108913178,https://hh.ru/vacancy/108913178,2024-10-20T21:41:47+0300,False,"Математическое, физико-техническое или IT-образование. Хорошее знание школьной программы по математике и физике. Знание основ программирования, школьной программы по...","Объяснение новых тем по алгебре, геометрии и физике. Обучение информатике и основам программирования. Контроль и проверка решений. Выявление и устранение..."
1029,Преподаватель английского языка,APPLE ZEBRA Company,250000.0,,Алматы,"Шымкент, улица Бейбитшилик, 20",https://hh.ru/applicant/vacancy_response?vacancyId=108499079,https://hh.ru/vacancy/108499079,2024-10-11T09:10:37+0300,False,Высшее или средне-специальное образование. Опыт работы не менее 3 лет. Международные стажировки и опыт работы/учёбы за рубежом приветствуются. ,"Проведение групповых и индивидуальных занятий для детей, школьников, студентов и взрослых."
1030,Head teacher / Director of English teachers,StudyON,300000.0,500000.0,Шымкент,"Шымкент, улица Алимбетова, 45В",https://hh.ru/applicant/vacancy_response?vacancyId=108976077,https://hh.ru/vacancy/108976077,2024-10-27T15:20:24+0300,False,"Minimum of 2 years experience in a teaching role. IELTS certificate. The ability to execute lessons with meaning, in a...","Perform <highlighttext>teacher</highlighttext> evaluations and provide academic support, training and additional tutoring to over 40 <highlighttext>teachers</highlighttext>. Prepare progress reports and conduct..."
1031,Учитель начальных классов,АЯГАНОВА КАЙНИКАМАЛ БОЛАТОВНА,200000.0,300000.0,Астана,"Нур-Султан (Астана), проспект Мангилик Ел, 51/6",https://hh.ru/applicant/vacancy_response?vacancyId=108194667,https://hh.ru/vacancy/108194667,2024-10-04T15:54:42+0300,False,"Мы ищем <highlighttext>учителя</highlighttext> по подготовке к школе НА РУССКОМ ЯЗЫКЕ в детский центр - целеустремленного, творческого человека, любящего детей и свою...",Работа с обучаемыми. Организация учебно-воспитательного процесса.
1032,Head teacher / Director of English teachers,Enbekshi A (StudyON),180000.0,350000.0,Тараз,"Тараз, проспект Жамбыла, 153",https://hh.ru/applicant/vacancy_response?vacancyId=108805671,https://hh.ru/vacancy/108805671,2024-10-26T15:17:56+0300,False,"Minimum of 2 years experience in a teaching role. IELTS certificate. The ability to execute lessons with meaning, in a...","Perform <highlighttext>teacher</highlighttext> evaluations and provide academic support, training and additional tutoring to over 15 <highlighttext>teachers</highlighttext>. Prepare progress reports and conduct..."
1033,Преподаватель русского языка,TODAY Qaragandy,350000.0,,Караганда,Караганда,https://hh.ru/applicant/vacancy_response?vacancyId=107331252,https://hh.ru/vacancy/107331252,2024-10-15T14:02:26+0300,False,Имеете высшее образование и опыт работы в аналогичной сфере. Владеете современными методиками обучения. Жаждете постоянно учиться и развиваться. ,Обучать учеников 4-5-6 классов. Составлять планы занятий для каждой группы. Писать обратную связь по успеваемости каждого ребенка. 
1034,Репетитор по математике,Умскул,,250000.0,Астана,"Астана, улица Достык, 5",https://hh.ru/applicant/vacancy_response?vacancyId=108598396,https://hh.ru/vacancy/108598396,2024-10-14T10:41:49+0300,False,"Опыт подготовки к ЕНТ от 1 года. – Творческий и гибкий подход в преподавании. – Высокий уровень владения предметом, знание специфики ЕНТ. – ","<highlighttext>Преподаватели</highlighttext> проводят онлайн-занятия один на один с учеником, учитывают потребности, возможности, а также особенности каждого ученика, разрабатывают индивидуальную траекторию..."
1035,Преподаватель по Программному обеспечению с русским языком обучения,УЧРЕЖДЕНИЕ ЭКОНОМИЧЕСКИЙ КОЛЛЕДЖ УНИВЕРСИТЕТА НАРХОЗ,200000.0,,Алматы,"Алматы, 10-й микрорайон, 7А",https://hh.ru/applicant/vacancy_response?vacancyId=108005858,https://hh.ru/vacancy/108005858,2024-10-01T15:46:07+0300,False,"Высшее образование, категория и Магистратура приветствуется. Предоставление программы обучения. Хорошие коммуникационные навыки.",Ведение уроков и лекций по своему предмету. Стимулирование у учеников интереса к информационным технологиям и вычислительной технике. Разработку и адаптацию...
1036,Преподаватель по IELTS,Мухамедиева Мадина Биржановна,300000.0,500000.0,Астана,"Астана, улица Бухар Жырау, 34/2",https://hh.ru/applicant/vacancy_response?vacancyId=109349720,https://hh.ru/vacancy/109349720,2024-10-26T15:19:34+0300,False,Оценка знаний студентов. -Дисциплинированность. -Ответственность. -Пунктуальность. -Опыт работы не менее 1 года. -Наличие Ielts не меньше 7.5 баллов. -,Преподавание уроков индивидуально и в мини-группах. -Составление учебной программы. -Индивидуальный подход к каждому ученику. Работа оффлайн.
1037,Учитель IELTS и General English ОФФЛАЙН Алматы,Камила,300000.0,,Алматы,"Алматы, микрорайон Мамыр-7, 16",https://hh.ru/applicant/vacancy_response?vacancyId=107992019,https://hh.ru/vacancy/107992019,2024-10-01T12:57:24+0300,False,Требуемый опыт работы: 1–3 года. Проведение уроков английского языка для различных возрастных категорий и уровней владения языком. ,"Оценка успеваемости учащихся, составление отчетов о прогрессе и рекомендации по дальнейшему обучению. Преподавать английский язык и IELTS детям и взрослым..."
1038,Менеджер по работе с клиентами,CodiPlay,,,Алматы,,https://hh.ru/applicant/vacancy_response?vacancyId=108419199,https://hh.ru/vacancy/108419199,2024-10-27T15:12:18+0300,False,Навыки коммуникации и организация процессов обучения. Знание английского языка B2. Готовность к командировкам.,"...ФИО директора школы, контактные данные <highlighttext>преподавателей</highlighttext>, подписанные договоры. 2. Выдача доступа <highlighttext>учителям</highlighttext>: Управление доступом <highlighttext>учителей</highlighttext> к образовательной платформе CodiPlay. "
1039,Учитель начальных классов,Жания&К,100000.0,300000.0,Астана,"Нур-Султан (Астана), микрорайон Промышленный, улица Шалкоде, 3",https://hh.ru/applicant/vacancy_response?vacancyId=108019859,https://hh.ru/vacancy/108019859,2024-10-01T19:36:57+0300,False,Ответственность. Добросовестность. Не отпрашиваться часто.,Проведение уроков. Доступно объяснять темы. Домашнее задание.
1040,Преподаватель английского языка,Capital Education Services,300000.0,350000.0,Алматы,,https://hh.ru/applicant/vacancy_response?vacancyId=108047885,https://hh.ru/vacancy/108047885,2024-10-26T12:14:05+0300,False,Развитие навыков восприятия и общения на английском языке у учащихся. - Свободное владение английским языком (уровень B2 и выше). - ,Проведение увлекательных и эффективных занятий для корпоративных клиентов. -Оценка прогресса учеников и предоставление обратной связи. -Проведение онлайн и оффлайн занятий.
1041,Тренер по танцам,OXFORD CREATIVE SCHOOL,100000.0,250000.0,Актобе,,https://hh.ru/applicant/vacancy_response?vacancyId=108854523,https://hh.ru/vacancy/108854523,2024-10-18T14:50:11+0300,False,Коммуникабельность. Ответственность. Умение ладить с детьми. Уметь доступно объяснять учебные материалы учащимся. Нестандартное мышление. Только писать на WhatsApp.,Обучение детей и взрослых в группах и индивидуально (творчески подход к проведению занятий).
1042,Преподаватель по Искусственному Интеллекту (AI),DataGroup Qazaqstan,300000.0,1000000.0,Астана,"Астана, улица Сарайшык, 7/7",https://hh.ru/applicant/vacancy_response?vacancyId=108134163,https://hh.ru/vacancy/108134163,2024-10-27T15:16:55+0300,False,"Отличные коммуникационные навыки, навыки презентации и грамотная речь. Наличие сертификатов и квалификаций в области искусственного интеллекта (например, TensorFlow Developer, Data...","Проведение занятий, семинаров и мастер-классов по основам и продвинутым аспектам Искусственного Интеллекта, включая машинное обучение, обработку естественного языка (NLP..."
1043,Учитель математики,"Назарбаев интеллектуальные школы, Автономная организация образования",,,Павлодар,,https://hh.ru/applicant/vacancy_response?vacancyId=108708517,https://hh.ru/vacancy/108708517,2024-10-16T08:06:38+0300,False,"Знание государственного языка не ниже уровней: «орта деңгей» – для <highlighttext>учителя</highlighttext> предметов, которые преподаются на государственном языке, «қарапайым деңгей» – для <highlighttext>учителя</highlighttext>...","Организует и проводит учебную и учебно-методическую работу. Проводит уроки, элективные часы, кружки. Применяет современные формы и методы обучения, инновационные..."
1044,Менеджер по продажам,Palme School inc,,1000.0,Астана,,https://hh.ru/applicant/vacancy_response?vacancyId=108803093,https://hh.ru/vacancy/108803093,2024-10-17T14:41:55+0300,False,"Обязателен опыт работы в продажах, без опыта в продажах не рассматриваем. Опыт работы с ПК и опыт работы в CRM...","Работать в CRM ( заявки, таблицы, история клиента ). Работать с теплой базой текущих и бывших клиентов, и информировать о наших акциях..."
1045,Преподаватель технических дисциплин,Школьные уроки,150000.0,250000.0,Усть-Каменогорск,,https://hh.ru/applicant/vacancy_response?vacancyId=108913186,https://hh.ru/vacancy/108913186,2024-10-20T21:41:47+0300,False,"Математическое, физико-техническое или IT-образование. Хорошее знание школьной программы по математике и физике. Знание основ программирования, школьной программы по...","Объяснение новых тем по алгебре, геометрии и физике. Обучение информатике и основам программирования. Контроль и проверка решений. Выявление и устранение..."
1046,Преподаватель математики,CleverS Astana,150000.0,,Астана,"Астана, улица Акмешит, 9/2",https://hh.ru/applicant/vacancy_response?vacancyId=108627939,https://hh.ru/vacancy/108627939,2024-10-26T15:42:14+0300,False,Но и ты должен(-на) быть не промах! Нам нужны люди: - ответственные. - дружелюбные. - энергичные. - быстрообучаемые. - результативные. - знают свой предмет на...,Обучение методике преподавания. - Участие в организации Республиканских и Международных проектов.
